{
  "schemaVersion": 1,
  "catalogVersion": "2026.08.26.2",
  "serviceDisablePolicy": "launchctl",
  "compatibility": {
    "minimumMacOSMajor": 15,
    "maximumMacOSMajor": 26,
    "architectures": [
      "arm64",
      "x86_64"
    ]
  },
  "categories": [
    {
      "id": "search-desktop",
      "title": "Search & Desktop",
      "systemImage": "magnifyingglass",
      "order": 100
    },
    {
      "id": "siri-intelligence",
      "title": "Siri & Intelligence",
      "systemImage": "waveform",
      "order": 200
    },
    {
      "id": "communication-continuity",
      "title": "Communication & Continuity",
      "systemImage": "message",
      "order": 300
    },
    {
      "id": "icloud-store",
      "title": "iCloud & Store",
      "systemImage": "icloud",
      "order": 400
    },
    {
      "id": "media-location",
      "title": "Media & Location",
      "systemImage": "photo.on.rectangle",
      "order": 500
    },
    {
      "id": "apple-apps",
      "title": "Apple Apps",
      "systemImage": "square.grid.2x2",
      "order": 600
    },
    {
      "id": "privacy-diagnostics",
      "title": "Privacy & Diagnostics",
      "systemImage": "hand.raised",
      "order": 700
    },
    {
      "id": "accessibility",
      "title": "Accessibility",
      "systemImage": "figure.stand",
      "order": 800
    },
    {
      "id": "system-network",
      "title": "System & Network",
      "systemImage": "gearshape.2",
      "order": 900
    }
  ],
  "services": [
    {
      "id": "metadata-mds",
      "label": "com.apple.metadata.mds",
      "domain": "system",
      "kind": "daemon"
    },
    {
      "id": "metadata-mds-index",
      "label": "com.apple.metadata.mds.index",
      "domain": "system",
      "kind": "daemon"
    },
    {
      "id": "metadata-mds-scan",
      "label": "com.apple.metadata.mds.scan",
      "domain": "system",
      "kind": "daemon"
    },
    {
      "id": "spotlight-agent",
      "label": "com.apple.Spotlight",
      "domain": "gui",
      "kind": "agent"
    },
    {
      "id": "corespotlightd",
      "label": "com.apple.corespotlightd",
      "domain": "gui",
      "kind": "agent"
    },
    {
      "id": "spotlightknowledged",
      "label": "com.apple.spotlightknowledged",
      "domain": "gui",
      "kind": "agent"
    },
    {
      "id": "metadata-mdworker-shared",
      "label": "com.apple.mdworker.shared",
      "domain": "gui",
      "kind": "agent"
    },
    {
      "id": "metadata-mdbulkimport",
      "label": "com.apple.metadata.mdbulkimport",
      "domain": "gui",
      "kind": "agent"
    },
    {
      "id": "metadata-mdwrite",
      "label": "com.apple.metadata.mdwrite",
      "domain": "gui",
      "kind": "agent"
    },
    {
      "id": "chronod",
      "label": "com.apple.chronod",
      "domain": "gui",
      "kind": "agent"
    },
    {
      "id": "mediaanalysisd",
      "label": "com.apple.mediaanalysisd",
      "domain": "gui",
      "kind": "agent"
    },
    {
      "id": "photoanalysisd",
      "label": "com.apple.photoanalysisd",
      "domain": "gui",
      "kind": "agent"
    },
    {
      "id": "photolibraryd",
      "label": "com.apple.photolibraryd",
      "domain": "gui",
      "kind": "agent"
    },
    {
      "id": "revisiond",
      "label": "com.apple.revisiond",
      "domain": "system",
      "kind": "daemon"
    },
    {
      "id": "homed",
      "label": "com.apple.homed",
      "domain": "gui",
      "kind": "agent"
    },
    {
      "id": "homeeventsd",
      "label": "com.apple.homeeventsd",
      "domain": "gui",
      "kind": "agent"
    },
    {
      "id": "homeenergyd",
      "label": "com.apple.homeenergyd",
      "domain": "gui",
      "kind": "agent"
    },
    {
      "id": "thread-commissioner",
      "label": "com.apple.ThreadCommissionerService",
      "domain": "gui",
      "kind": "agent"
    },
    {
      "id": "threadradiod",
      "label": "com.apple.threadradiod",
      "domain": "system",
      "kind": "daemon"
    },
    {
      "id": "corespeechd",
      "label": "com.apple.corespeechd",
      "domain": "gui",
      "kind": "agent"
    },
    {
      "id": "corespeechd-system",
      "label": "com.apple.corespeechd_system",
      "domain": "system",
      "kind": "daemon"
    },
    {
      "id": "assistantd",
      "label": "com.apple.assistantd",
      "domain": "gui",
      "kind": "agent"
    },
    {
      "id": "assistant-service",
      "label": "com.apple.assistant_service",
      "domain": "gui",
      "kind": "agent"
    },
    {
      "id": "assistant-cdmd",
      "label": "com.apple.assistant_cdmd",
      "domain": "gui",
      "kind": "agent"
    },
    {
      "id": "dictation-im",
      "label": "com.apple.DictationIM",
      "domain": "gui",
      "kind": "agent"
    },
    {
      "id": "asr",
      "label": "com.apple.asr",
      "domain": "system",
      "kind": "daemon"
    },
    {
      "id": "voicebankingd",
      "label": "com.apple.voicebankingd",
      "domain": "gui",
      "kind": "agent"
    },
    {
      "id": "voicememod",
      "label": "com.apple.voicememod",
      "domain": "gui",
      "kind": "agent"
    },
    {
      "id": "speech-synthesisserver",
      "label": "com.apple.speech.synthesisserver",
      "domain": "gui",
      "kind": "agent"
    },
    {
      "id": "speech-datainstallerd",
      "label": "com.apple.speech.speechdatainstallerd",
      "domain": "gui",
      "kind": "agent"
    },
    {
      "id": "siri-tts-training",
      "label": "com.apple.SiriTTSTrainingAgent",
      "domain": "gui",
      "kind": "agent"
    },
    {
      "id": "speechsynthesisd-arm64",
      "label": "com.apple.speech.speechsynthesisd.arm64",
      "domain": "gui",
      "kind": "agent"
    },
    {
      "id": "axassetsd",
      "label": "com.apple.accessibility.axassetsd",
      "domain": "gui",
      "kind": "agent"
    },
    {
      "id": "accessibility-heard",
      "label": "com.apple.accessibility.heard",
      "domain": "gui",
      "kind": "agent"
    },
    {
      "id": "accessibility-visuals",
      "label": "com.apple.AccessibilityVisualsAgent",
      "domain": "gui",
      "kind": "agent"
    },
    {
      "id": "generativeexperiencesd",
      "label": "com.apple.generativeexperiencesd",
      "domain": "gui",
      "kind": "agent"
    },
    {
      "id": "modelmanagerd",
      "label": "com.apple.modelmanagerd",
      "domain": "system",
      "kind": "daemon"
    },
    {
      "id": "modelcatalogd",
      "label": "com.apple.modelcatalogd",
      "domain": "system",
      "kind": "daemon"
    },
    {
      "id": "model-catalog-agent",
      "label": "com.apple.ModelCatalogAgent",
      "domain": "gui",
      "kind": "agent"
    },
    {
      "id": "intelligenceplatformd",
      "label": "com.apple.intelligenceplatformd",
      "domain": "gui",
      "kind": "agent"
    },
    {
      "id": "textcomposerd",
      "label": "com.apple.textcomposerd",
      "domain": "gui",
      "kind": "agent"
    },
    {
      "id": "triald",
      "label": "com.apple.triald",
      "domain": "gui",
      "kind": "agent"
    },
    {
      "id": "biome-agent",
      "label": "com.apple.BiomeAgent",
      "domain": "gui",
      "kind": "agent"
    },
    {
      "id": "biomed",
      "label": "com.apple.biomed",
      "domain": "system",
      "kind": "daemon"
    },
    {
      "id": "biomesyncd",
      "label": "com.apple.biomesyncd",
      "domain": "gui",
      "kind": "agent"
    },
    {
      "id": "routined",
      "label": "com.apple.routined",
      "domain": "gui",
      "kind": "agent"
    },
    {
      "id": "context-store-agent",
      "label": "com.apple.ContextStoreAgent",
      "domain": "gui",
      "kind": "agent"
    },
    {
      "id": "contextstored",
      "label": "com.apple.contextstored",
      "domain": "system",
      "kind": "daemon"
    },
    {
      "id": "duetexpertd",
      "label": "com.apple.duetexpertd",
      "domain": "gui",
      "kind": "agent"
    },
    {
      "id": "proactived",
      "label": "com.apple.proactived",
      "domain": "gui",
      "kind": "agent"
    },
    {
      "id": "proactiveeventtrackerd",
      "label": "com.apple.proactiveeventtrackerd",
      "domain": "gui",
      "kind": "agent"
    },
    {
      "id": "coreduetd",
      "label": "com.apple.coreduetd",
      "domain": "system",
      "kind": "daemon"
    },
    {
      "id": "ospredictiond",
      "label": "com.apple.ospredictiond",
      "domain": "system",
      "kind": "daemon"
    },
    {
      "id": "analyticsd",
      "label": "com.apple.analyticsd",
      "domain": "system",
      "kind": "daemon"
    },
    {
      "id": "analyticsagent",
      "label": "com.apple.analyticsagent",
      "domain": "gui",
      "kind": "agent"
    },
    {
      "id": "osanalytics-helper",
      "label": "com.apple.osanalytics.osanalyticshelper",
      "domain": "system",
      "kind": "daemon"
    },
    {
      "id": "rtcreportingd",
      "label": "com.apple.rtcreportingd",
      "domain": "system",
      "kind": "daemon"
    },
    {
      "id": "geoanalyticsd",
      "label": "com.apple.geoanalyticsd",
      "domain": "gui",
      "kind": "agent"
    },
    {
      "id": "metrickitd",
      "label": "com.apple.metrickitd",
      "domain": "gui",
      "kind": "agent"
    },
    {
      "id": "inputanalyticsd-user",
      "label": "com.apple.inputanalyticsd",
      "domain": "gui",
      "kind": "agent"
    },
    {
      "id": "audioanalyticsd",
      "label": "com.apple.audioanalyticsd",
      "domain": "system",
      "kind": "daemon"
    },
    {
      "id": "systemstats-analysis",
      "label": "com.apple.systemstats.analysis",
      "domain": "system",
      "kind": "daemon"
    },
    {
      "id": "systemstats-daily",
      "label": "com.apple.systemstats.daily",
      "domain": "system",
      "kind": "daemon"
    },
    {
      "id": "systemstats-microstackshot",
      "label": "com.apple.systemstats.microstackshot_periodic",